Line,Time,Remark
1,2022_04_22 18:00:47.793374,TM50870073,ENE,Address85 Part:,HD 85
,,"STRUCTURE=MANHOLE COVER, VOLTAGE=25.2, GROUND=OFTAL CURB, MSPLATE=14E, HARMONIC=13.3, V NON-SHUNT=33.3, STATUS=CREW WAITING"
2,2022_04_22 19:55:51.993374,TM50870073: Comment: BFS REQUIRED ON SITE
3,2022_04_22 20:38:10.593374,TM50870073: Comment: SERVICE VEHICLE REQUESTED
4,2022_04_22 22:48:14.193374,TM50870073: Comment: MAINTENANCE PERSON REQUIRED TO SHUT BREAKER OFF
5,2022_04_23 01:18:05.793374,TM50870073: Comment: 2.5 VOLTS REMAINING
6,2022_04_23 03:54:38.193374,TM50870073: Comment: CONTACT S&R
7,2022_04_23 05:04:26.793374,"TM50870073: Comment: INFOROFD I&A, CREW WILL EB ON LOCATION UNTIL 5PM"
8,2022_04_23 05:40:07.593374,TM50870073: Comment: I&A WILL NOTIFY IF CREW IS AVAILABLE
