Line,Time,Remark
1,2022_04_22 14:54:02.232826,TM79714377,ENE,Address146 Part:,OF 146
,,"STRUCTURE=GAS CAP, VOLTAGE=63.1, GROUND=STREETSIGN, MSPLATE=80EU, HARMONIC=1.1, V NON-SHUNT=72.7, STATUS=PASSIVE SITE SAFETY"
2,2022_04_22 16:52:55.032826,TM79714377: Comment: 49.9 VOLTS
3,2022_04_22 17:34:34.632826,"TM79714377: Comment: SURVEY CONDUCTED, REPORTS 78BQ"
4,2022_04_22 20:07:12.432826,TM79714377: Comment: CREW NOTIFIED
5,2022_04_22 21:56:21.432826,TM79714377: Comment: CONTACT S&R
6,2022_04_23 00:31:00.432826,TM79714377: Comment: LOAD TEST SUCCEEDED AT 2:15HRS
7,2022_04_23 00:47:55.632826,TM79714377: Comment: ELECTRICIAN RELEASED AT 1:31HRS
8,2022_04_23 02:23:10.632826,TM79714377: Comment: EXPECTED SIDEWALK GOT DIRT
